{
  "$comment": "Dựng lại vì drift: NOW cũ mốc 29/7, focus B19 khi ấy CHƯA file nào tồn tại — nay cả ba file B19 lẫn 2 test đã có (untracked từ 30/7) và BACKLOG có khối ✅ B19 (30/7 khuya). Từ đó phát sinh surface MỚI hôm nay 3/8: app thanh menu macOS. Nguồn: git log/status (vẫn 1 commit 2a46a30, working tree phình lớn chưa commit), mtime toàn repo (app/NowMenuBar.swift 19:33, README 23:31 — sửa tới khuya nay), grep server.js (/api/badge + badgeOf sống), ls ~/Applications (NOW Dashboard.app dựng 20:39 hôm nay = app ĐÃ cài), npm test (337/337, +flake butler sau-22h vừa vá), curl :4400 (200) + launchctl (dev.hoanluu.now-dash sống), git diff BACKLOG (chỉ có khối B19, CHƯA mục nào cho menubar), README diff (mô tả install-app + tune bằng mắt + linh vật). Không có phiên nào đang cầm việc.",
  "schemaVersion": 1,
  "project": "now_dashboard",
  "branch": "main",
  "updatedAt": "2026-08-03",
  "updatedAtCommit": "2a46a30c70aa38b678b2d232d89858b7678a4bf9",
  "updatedBy": "claude /now (auto-update vì drift)",
  "focus": {
    "title": "App trên thanh menu macOS — badge liếc-là-thấy + popover dùng lại NGUYÊN quotaBar/CSS của dashboard",
    "context": "Focus trước (B19 — màn \"Nhìn lại\", phím 8) đã khép 30/7 khuya: xong cả server (src/lib/cycles.js + src/collect/lookback.js) lẫn client (public/views/lookback.js), nghiệm thu trên app thật VI/EN × hai nền, state.lookback chỉ 1.193 byte; ba rủi ro phỏng vấn đóng bằng số đo (tiền Cursor khớp planUsage 0,0%, AG có dải ngày thật, sổ AG 5h là rác trượt chỉ nhận -weekly). Hôm nay 3/8 dựng một SURFACE MỚI — app trên thanh menu macOS, cả ngày tới tận khuya: (1) server thêm /api/badge (badgeOf, nhịp 30s), (2) app Swift native app/NowMenuBar.swift (404 dòng, AppKit+WebKit) dựng qua bin/install-app → ĐÃ CÀI ~/Applications/NOW Dashboard.app (build 20:39), (3) popover là chính trang menubar.html — KHÔNG phải màn thứ 8, không nav/router/SSE — dùng lại nguyên quotaBar và CSS dashboard (public/menubar.js + public/lib/menubar-view.js 462 dòng, có linh vật phaseOf/shadeOf theo giờ), (4) demo public/menubar-demo.*, (5) +489 dòng CSS mb-*, +426 i18n VI/EN, README ghi trọn cách cài + canh chữ bằng mắt (NOW_SNAP/NOW_PROBE). Đã vá lỗi sống-từ-ngày-đầu: popover hỏi chiều cao trong didFinish lúc trang còn await fetch → nay trang tự đẩy size qua webkit.messageHandlers. npm test 337/337 (đã vá luôn flake 2 test butler đỏ sau 22h). CHƯA commit dòng nào, và CHƯA có mục nào trong BACKLOG cho surface này.",
    "refs": [
      { "label": "App Swift — nguồn, ranh giới 'không biết luật hạn mức nào'", "ref": "app/NowMenuBar.swift" },
      { "label": "Script dựng + cài .app (chốt chặn không đè NOW.app)", "ref": "bin/install-app" },
      { "label": "Popover — dùng lại quotaBar + linh vật phaseOf/shadeOf", "ref": "public/lib/menubar-view.js" }
    ],
    "nextAction": "Nghiệm thu app đã cài trên dữ liệu thật: mở popover từ ~/Applications/NOW Dashboard.app xem badge 30s + quotaBar, VI/EN × sáng/tối, console 0 lỗi — menubar-view.js là public/lib nên CLAUDE.md mục 4 BUỘC xem thật, đừng dừng ở npm test 337 xanh",
    "laterSteps": [
      "Ghi surface 'App thanh menu' vào BACKLOG.md — grep B2x/menu/badge đang RỖNG, chưa có mục nào cho nó; viết một khối ✅ có số đo như cách B19 được ghi 30/7",
      "Commit khối việc lớn đang treo: repo mới đúng 1 commit initial (2a46a30) mà cả B19 (cycles.js/lookback.js/views/lookback.js + 2 test, untracked từ 30/7) LẪN toàn bộ app thanh menu hôm nay (app/, bin/install-app, public/menubar*.js) đều chưa vào commit nào",
      "Dọn nợ git hygiene còn treo từ 29/7: NOW.json/NOW.md vẫn hiện `M` (đang bị track) dù đã thêm .gitignore + git rm --cached — bản vá đó chưa commit, và chính .gitignore còn ở trạng thái untracked (??)"
    ],
    "resume": {
      "workingState": "git: nhánh main, ĐÚNG 1 commit (2a46a30 initial squash), KHÔNG worktree phụ. Working tree phình lớn & chưa commit: ~13 file M + ~12 file untracked — gồm TRỌN B19 (cycles.js, lookback.js, views/lookback.js + 2 test, untracked từ 30/7) và TRỌN app thanh menu hôm nay (app/NowMenuBar.swift, app/Info.plist, app/make-tones.py, bin/install-app, public/menubar.html/js, public/lib/menubar-view.js, public/menubar-demo.*). NOW.json/NOW.md vẫn bị track (hiện M) — vá .gitignore từ 29/7 chưa commit · server qua launchd (dev.hoanluu.now-dash, pid 37645) sống, :4400 trả 200 · app ĐÃ cài: ~/Applications/NOW Dashboard.app (build 20:39 hôm nay) · npm test 337/337 xanh (314 lúc mốc 29/7 → 334 sau B19 → 337, thêm test menubar + vá flake butler sau-22h)",
      "howToContinue": "Không có phiên nào đang cầm việc — mở phiên mới, nói: xem lại app thanh menu đã cài, chạy nghiệm thu popover VI/EN × sáng/tối trên dữ liệu thật, rồi bàn có commit khối B19+menubar và ghi BACKLOG không"
    },
    "confidence": "inferred"
  },
  "sideTracks": [],
  "decisionsNeeded": [
    {
      "id": "d-push",
      "title": "Đẩy dist/ lên project claude.ai mà không mất thẻ prototype",
      "heat": "soon",
      "blocks": "vòng thiết kế đã dịch tiếp (B19 xong 30/7, nay tới surface thanh menu) nên project trên claude.ai càng lệch xa: dist/screens/overview.html còn đứng mốc 26/7 — cũ hơn cả tokens.json 27/7 lẫn mọi việc từ đó",
      "question": "dist/screens/overview.html là mock tĩnh, thẻ cùng tên trên project là prototype tương tác 56KB. Đẩy dist/ nhưng bỏ qua đúng file đó, hay đẩy cả và chấp nhận thẻ prototype bị thay bằng mock?",
      "ref": "design/README.md",
      "since": "2026-07-23"
    },
    {
      "id": "d-backlog-now",
      "title": "BACKLOG.md và NOW.json: giữ tách vai hay gộp/liên kết chặt hơn",
      "heat": "later",
      "blocks": "vẫn chưa chặn gì, nhưng mỗi /now update phải tự đoán ranh giới upNext ↔ BACKLOG.md — và lượt này lộ thêm một khe: surface thanh menu làm cả ngày mà KHÔNG rơi vào BACKLOG lẫn NOW cho tới khi /now đo drift; khuyến nghị 'giữ tách vai, chỉ nâng LIÊN KẾT' đưa ra 29/7 vẫn chưa nghe bạn chốt",
      "question": "Đồng ý GIỮ tách vai (BACKLOG.md = nguồn sự thật, NOW.json = digest) và chỉ nâng cấp liên kết (vd /now update đọc BACKLOG.md làm nguồn upNext thay vì tự đoán), hay muốn một trong ba nâng cấp đã liệt (đọc BACKLOG.md tự động / trang backlog riêng trên dashboard / chuẩn hoá format cho /now all)?",
      "ref": "BACKLOG.md",
      "since": "2026-07-29"
    }
  ],
  "upNext": [
    {
      "title": "task_33a66d84 (từ /reflect): modules.test.js vẫn chỉ import, chưa gọi hàm render thật của từng view — lỗ '288 test xanh mà #view rỗng' (CLAUDE.md mục 4) nay càng đáng vì có THÊM hai surface render-lúc-chạy chưa ai bắt bằng test: views/lookback.js và menubar-view.js",
      "ref": "test/modules.test.js"
    },
    {
      "title": "B13 — run() trong src/lib/sh.js vẫn nuốt lý do lỗi (không đổi từ 23/7); BACKLOG xếp đầu hàng vì là điều kiện chẩn đoán mọi lỗi khác — vừa dựng service/app native lại thấy cái giá của hỏng-im-lặng",
      "ref": "BACKLOG.md"
    },
    {
      "title": "B14 — payload /api/state 322,6KB (mốc hạ ưu tiên 119,5KB, gấp 2,7 lần); ~11% là phiên/hội thoại serialize hai lần, bỏ hàng đúp bằng id là bước rẻ nhất. Đã kiểm: state.lookback của B19 chỉ 1.193 byte nên KHÔNG nuôi thêm B14",
      "ref": "BACKLOG.md"
    },
    {
      "title": "B18 — giãn nhịp quét khi vắng người xem: 1,6% một core, chỉ đáng nếu chạy 24/7 quanh năm; B17 đã cắt ~230ms mỗi lượt nên bớt cấp bách. B6 (dựng lại theo dự án) vẫn hoãn vô thời hạn — chi phí nặng là quét NGUỘI, không phải cái tốn mỗi-30-giây",
      "ref": "BACKLOG.md"
    }
  ],
  "recentlyDone": [
    {
      "date": "2026-08-03",
      "title": "Dựng SURFACE MỚI — app trên thanh menu macOS: /api/badge (server, badgeOf 30s) + app Swift native app/NowMenuBar.swift dựng qua bin/install-app → ĐÃ CÀI ~/Applications/NOW Dashboard.app (20:39) + popover menubar.html dùng lại nguyên quotaBar/CSS dashboard (public/menubar*.js, lib/menubar-view.js có linh vật phaseOf/shadeOf); +489 CSS mb-*, +426 i18n VI/EN, README ghi trọn cách cài. Vá lỗi sống-từ-ngày-đầu (popover hỏi chiều cao lúc trang chưa fetch → nay đẩy size qua webkit.messageHandlers) + vá flake 2 test butler đỏ sau 22h. Test 334→337. CHƯA commit, CHƯA vào BACKLOG",
      "ref": "app/NowMenuBar.swift"
    },
    {
      "date": "2026-07-30",
      "title": "B19 (màn \"Nhìn lại\", phím 8) XONG trong một phiên, nghiệm thu trên app thật VI/EN × hai nền — cả server (cycles.js + lookback.js, state.lookback 1.193 byte) lẫn client. Ba rủi ro phỏng vấn đóng bằng số đo: tiền Cursor khớp planUsage 0,0% ($68,07=$68,07), AG có dải ngày thật (đỉnh 28/7: 1.631 lượt), sổ AG 5h là rác trượt chỉ nhận -weekly. Test 314→334",
      "ref": "BACKLOG.md"
    },
    {
      "date": "2026-07-29",
      "title": "git init + push lên GitHub (archimonde12/now_dashboard, 116 file, 1 commit) — chốt d-git. Lỡ cuốn NOW.json/NOW.md vào commit (thiếu .gitignore); vá .gitignore + git rm --cached nhưng bản vá tới nay VẪN chưa commit",
      "ref": ".gitignore"
    },
    {
      "date": "2026-07-28",
      "title": "Đề xuất màn \"Nhìn lại\" (phím 8) duyệt tối 28/7 kèm 12 quyết định phỏng vấn + mock hợp đồng; tracker ag-cycles/cursor-cycles dựng ngay đêm đó, kịp trước reset AG 08:04 sáng 29/7. B16 (hết ký sinh phiên Claude — launchd + ghim cổng 4400) + B17 (memo TTL) + B10/B15 (câu 'đang quét lần đầu' phân 3 pha) xong và kiểm sống",
      "ref": "docs/PROPOSAL-nhin-lai.md"
    }
  ]
}
